[INFO] Scanning for projects...
[INFO] 
[INFO] --------------< io.github.bonigarcia:junit5-basic-tests >---------------
[INFO] Building junit5-basic-tests 1.0.0
[INFO]   from pom.xml
[INFO] --------------------------------[ jar ]---------------------------------
[INFO] 
[INFO] --- resources:3.3.1:resources (default-resources) @ junit5-basic-tests ---
[INFO] Copying 0 resource from src/main/resources to target/classes
[INFO] 
[INFO] --- compiler:3.13.0:compile (default-compile) @ junit5-basic-tests ---
[INFO] Nothing to compile - all classes are up to date.
[INFO] 
[INFO] --- resources:3.3.1:testResources (default-testResources) @ junit5-basic-tests ---
[INFO] skip non existing resourceDirectory /Users/goncalosimoes/Desktop/EI3A1S/TQS/labs/lab1/lab1_2/src/test/resources
[INFO] 
[INFO] --- compiler:3.13.0:testCompile (default-testCompile) @ junit5-basic-tests ---
[INFO] Nothing to compile - all classes are up to date.
[INFO] 
[INFO] --- surefire:3.5.3:test (default-test) @ junit5-basic-tests ---
[INFO] Using auto detected provider org.apache.maven.surefire.junitplatform.JUnitPlatformProvider
[INFO] 
[INFO] -------------------------------------------------------
[INFO]  T E S T S
[INFO] -------------------------------------------------------
[INFO] Running TqsStackTest
[ERROR] Tests run: 8, Failures: 5, Errors: 0, Skipped: 0, Time elapsed: 0.034 s <<< FAILURE! -- in TqsStackTest
[ERROR] TqsStackTest.pushThenPeek -- Time elapsed: 0.004 s <<< FAILURE!
org.opentest4j.AssertionFailedError: expected: <test> but was: <null>
	at org.junit.jupiter.api.AssertionFailureBuilder.build(AssertionFailureBuilder.java:151)
	at org.junit.jupiter.api.AssertionFailureBuilder.buildAndThrow(AssertionFailureBuilder.java:132)
	at org.junit.jupiter.api.AssertEquals.failNotEqual(AssertEquals.java:197)
	at org.junit.jupiter.api.AssertEquals.assertEquals(AssertEquals.java:182)
	at org.junit.jupiter.api.AssertEquals.assertEquals(AssertEquals.java:177)
	at org.junit.jupiter.api.Assertions.assertEquals(Assertions.java:1145)
	at TqsStackTest.pushThenPeek(TqsStackTest.java:55)
	at java.base/java.lang.reflect.Method.invoke(Method.java:580)
	at java.base/java.util.ArrayList.forEach(ArrayList.java:1597)
	at java.base/java.util.ArrayList.forEach(ArrayList.java:1597)

[ERROR] TqsStackTest.pushThenPop -- Time elapsed: 0.001 s <<< FAILURE!
org.opentest4j.AssertionFailedError: expected: <test> but was: <null>
	at org.junit.jupiter.api.AssertionFailureBuilder.build(AssertionFailureBuilder.java:151)
	at org.junit.jupiter.api.AssertionFailureBuilder.buildAndThrow(AssertionFailureBuilder.java:132)
	at org.junit.jupiter.api.AssertEquals.failNotEqual(AssertEquals.java:197)
	at org.junit.jupiter.api.AssertEquals.assertEquals(AssertEquals.java:182)
	at org.junit.jupiter.api.AssertEquals.assertEquals(AssertEquals.java:177)
	at org.junit.jupiter.api.Assertions.assertEquals(Assertions.java:1145)
	at TqsStackTest.pushThenPop(TqsStackTest.java:45)
	at java.base/java.lang.reflect.Method.invoke(Method.java:580)
	at java.base/java.util.ArrayList.forEach(ArrayList.java:1597)
	at java.base/java.util.ArrayList.forEach(ArrayList.java:1597)

[ERROR] TqsStackTest.popEmptyStack -- Time elapsed: 0.001 s <<< FAILURE!
org.opentest4j.AssertionFailedError: Expected java.util.NoSuchElementException to be thrown, but nothing was thrown.
	at org.junit.jupiter.api.AssertionFailureBuilder.build(AssertionFailureBuilder.java:152)
	at org.junit.jupiter.api.AssertThrows.assertThrows(AssertThrows.java:73)
	at org.junit.jupiter.api.AssertThrows.assertThrows(AssertThrows.java:35)
	at org.junit.jupiter.api.Assertions.assertThrows(Assertions.java:3128)
	at TqsStackTest.popEmptyStack(TqsStackTest.java:79)
	at java.base/java.lang.reflect.Method.invoke(Method.java:580)
	at java.base/java.util.ArrayList.forEach(ArrayList.java:1597)
	at java.base/java.util.ArrayList.forEach(ArrayList.java:1597)

[ERROR] TqsStackTest.afterNPushes -- Time elapsed: 0.001 s <<< FAILURE!
org.opentest4j.AssertionFailedError: expected: <3> but was: <0>
	at org.junit.jupiter.api.AssertionFailureBuilder.build(AssertionFailureBuilder.java:151)
	at org.junit.jupiter.api.AssertionFailureBuilder.buildAndThrow(AssertionFailureBuilder.java:132)
	at org.junit.jupiter.api.AssertEquals.failNotEqual(AssertEquals.java:197)
	at org.junit.jupiter.api.AssertEquals.assertEquals(AssertEquals.java:150)
	at org.junit.jupiter.api.AssertEquals.assertEquals(AssertEquals.java:145)
	at org.junit.jupiter.api.Assertions.assertEquals(Assertions.java:531)
	at TqsStackTest.afterNPushes(TqsStackTest.java:36)
	at java.base/java.lang.reflect.Method.invoke(Method.java:580)
	at java.base/java.util.ArrayList.forEach(ArrayList.java:1597)
	at java.base/java.util.ArrayList.forEach(ArrayList.java:1597)

[ERROR] TqsStackTest.peekEmptyStack -- Time elapsed: 0.001 s <<< FAILURE!
org.opentest4j.AssertionFailedError: Expected java.util.NoSuchElementException to be thrown, but nothing was thrown.
	at org.junit.jupiter.api.AssertionFailureBuilder.build(AssertionFailureBuilder.java:152)
	at org.junit.jupiter.api.AssertThrows.assertThrows(AssertThrows.java:73)
	at org.junit.jupiter.api.AssertThrows.assertThrows(AssertThrows.java:35)
	at org.junit.jupiter.api.Assertions.assertThrows(Assertions.java:3128)
	at TqsStackTest.peekEmptyStack(TqsStackTest.java:87)
	at java.base/java.lang.reflect.Method.invoke(Method.java:580)
	at java.base/java.util.ArrayList.forEach(ArrayList.java:1597)
	at java.base/java.util.ArrayList.forEach(ArrayList.java:1597)

[INFO] 
[INFO] Results:
[INFO] 
[ERROR] Failures: 
[ERROR]   TqsStackTest.afterNPushes:36 expected: <3> but was: <0>
[ERROR]   TqsStackTest.peekEmptyStack:87 Expected java.util.NoSuchElementException to be thrown, but nothing was thrown.
[ERROR]   TqsStackTest.popEmptyStack:79 Expected java.util.NoSuchElementException to be thrown, but nothing was thrown.
[ERROR]   TqsStackTest.pushThenPeek:55 expected: <test> but was: <null>
[ERROR]   TqsStackTest.pushThenPop:45 expected: <test> but was: <null>
[INFO] 
[ERROR] Tests run: 8, Failures: 5, Errors: 0, Skipped: 0
[INFO] 
[INFO] ------------------------------------------------------------------------
[INFO] BUILD FAILURE
[INFO] ------------------------------------------------------------------------
[INFO] Total time:  0.709 s
[INFO] Finished at: 2025-09-29T12:59:11+01:00
[INFO] ------------------------------------------------------------------------
[ERROR] Failed to execute goal org.apache.maven.plugins:maven-surefire-plugin:3.5.3:test (default-test) on project junit5-basic-tests: There are test failures.
[ERROR] 
[ERROR] See /Users/goncalosimoes/Desktop/EI3A1S/TQS/labs/lab1/lab1_2/target/surefire-reports for the individual test results.
[ERROR] See dump files (if any exist) [date].dump, [date]-jvmRun[N].dump and [date].dumpstream.
[ERROR] -> [Help 1]
[ERROR] 
[ERROR] To see the full stack trace of the errors, re-run Maven with the -e switch.
[ERROR] Re-run Maven using the -X switch to enable full debug logging.
[ERROR] 
[ERROR] For more information about the errors and possible solutions, please read the following articles:
[ERROR] [Help 1] http://cwiki.apache.org/confluence/display/MAVEN/MojoFailureException
